{"checks":{"baseline_fails":{"command_digest_sha256":"f8242467886411ddbcaabf97b53a59669b4474148ea8d4eacca5ffb66019320a","evidence":[{"digest_sha256":"258354e86b562af25164b9d9a11cb4ff637888420ee6a6e26f166b63f8033684","path":"contracts/tasks/omp-native.distributed-lease-deadlock/1.0.0/evidence/baseline-1.json"},{"digest_sha256":"e366d0351e0f17c84b3bba25e53d7e34e2c324b3f7f1a3e348272a4e7295b236","path":"contracts/tasks/omp-native.distributed-lease-deadlock/1.0.0/evidence/baseline-2.json"}],"result":"pass"},"determinism":"pass","discrimination":"calibration-required","infrastructure_classification":"pass","license":"pass","observation_authority":"pass","privacy":"pass","reference_passes":{"command_digest_sha256":"f3ef9fb83e53496beed83eb0f1b0202dcf8014d04fb6c7f8d52a2fb1d64fbeae","evidence":[{"digest_sha256":"eb95d04549dc029b4afad641cef5e6fa4eb467bb672196d5a436fcd7f4658299","path":"contracts/tasks/omp-native.distributed-lease-deadlock/1.0.0/evidence/reference-1.json"},{"digest_sha256":"6404634ff20bd49376b28e282dd0acc7bae77eab5304e8255eec18df4b8adfcb","path":"contracts/tasks/omp-native.distributed-lease-deadlock/1.0.0/evidence/reference-2.json"}],"result":"pass"},"runner_isolation":"pass","tamper_resistance":{"command_digest_sha256":"547dec54bdea4291ff49c1f2f49a710dfe024e6a11a93b632e8207c3534ae851","evidence":[{"digest_sha256":"9e9825f98d2f64ff37a7d43af3956c5416b5427271d1954a634173feacccfd78","path":"contracts/tasks/omp-native.distributed-lease-deadlock/1.0.0/evidence/tamper-1.json"},{"digest_sha256":"7f104c0f5217896086a3420b67bba884e36df15e767509d039017960b11da031","path":"contracts/tasks/omp-native.distributed-lease-deadlock/1.0.0/evidence/tamper-2.json"}],"result":"pass"},"verifier_isolation":"pass"},"content_digest_sha256":"7fec3ca1d4fa647846dbe4cf482bbf5acbbdeb2f0a86885a99ede0a74ef189d2","decision":"calibration-required","evaluation_provenance":{"review_digest_sha256":"fb4d56e1fd73b035d1d2507e29c377f467c84866f5fe089a0e853a82ddd92d28","reviewer_id":"rolebench/reviewer/verifier-gate-v1","runner_config_digest_sha256":"41f911a1da43d51265959cd2227a2e5cb806e2d9970a8ec3ed4084bddd7e8aa0","runner_image":"rolebench.local/omp-native.distributed-lease-deadlock-runner@sha256:7380f77d231a3bbf7853ffd769f3194d4f39f724fd195f356c344b5c0906fd63","runner_platform":{"architecture":"amd64","os":"linux","variant":null},"verifier_config_digest_sha256":"a37778cd7b1563d7b8bdd0194c6cb49ba919b296fc5597924e7420613e481aaa","verifier_image":"rolebench.local/omp-native.distributed-lease-deadlock-verifier@sha256:c34ece628889ffc955db8e031784fd4769293c8b623a4d3c7094e08cd571ad29","verifier_platform":{"architecture":"amd64","os":"linux","variant":null}},"observed_mapping":{"agent_config_digest_sha256":"73ec4db874f4b405e5a7976eb2cb5234fd5b4f3a8f7d0b9128a3ff2a4766ceaa","public_tree_digest_sha256":"a279a58e9f66571f4a2b815148289e7d6a5ebe96c2c754d029ab6c96b0b6402b","runner_config_digest_sha256":"41f911a1da43d51265959cd2227a2e5cb806e2d9970a8ec3ed4084bddd7e8aa0","task_digest_sha256":"151bbc9e2faa677d6417daf3a055f6990ddd0ee87d936c44a6aeff3a83cca76e","verifier_config_digest_sha256":"a37778cd7b1563d7b8bdd0194c6cb49ba919b296fc5597924e7420613e481aaa","verifier_private_tree_digest_sha256":"795c8bb9a218eb0009d6824e4aa89245bedbc2f6a9bdedc01054b415f8fcbea1"},"reviews":{"license":{"decision":"approved","evidence_digest_sha256":"bba75f3bb4c8f2e2cd51eb85fafe161f87cf2c28e87c7215accbe2ef78b42f06","evidence_path":"contracts/tasks/omp-native.distributed-lease-deadlock/1.0.0/reviews/license.json","expression":"MIT","redistribution":"permitted","reviewed_at":"2026-08-16T15:00:00Z","reviewer":"rolebench/reviewer/license-gate-v1"},"privacy":{"decision":"approved","evidence_digest_sha256":"4d6ef103c0307be382a331f44a863f6867745475f5f3a48a97d75a1b05e16329","evidence_path":"contracts/tasks/omp-native.distributed-lease-deadlock/1.0.0/reviews/privacy.json","reviewed_at":"2026-08-16T15:00:00Z","reviewer":"rolebench/reviewer/privacy-gate-v1"},"split":{"assignment_method":"author-assigned","confidentiality":"public","decision":"approved","evidence_digest_sha256":"a6cfe74a5c966d9fedae8fecf3897b70e786099d72a8854e23f684bd4fd9b160","evidence_path":"contracts/tasks/omp-native.distributed-lease-deadlock/1.0.0/reviews/split.json","family_id":"omp-native.distributed-lease-deadlock","partition":"anchor","reviewed_at":"2026-08-16T15:00:00Z","reviewer":"rolebench/reviewer/role-fit-gate-v1"},"verifier":{"decision":"approved","evidence_digest_sha256":"fb4d56e1fd73b035d1d2507e29c377f467c84866f5fe089a0e853a82ddd92d28","evidence_path":"contracts/tasks/omp-native.distributed-lease-deadlock/1.0.0/reviews/verifier.json","private_tree_digest_sha256":"795c8bb9a218eb0009d6824e4aa89245bedbc2f6a9bdedc01054b415f8fcbea1","reviewed_at":"2026-08-16T15:15:00Z","reviewer":"rolebench/reviewer/verifier-gate-v1","runner_config_digest_sha256":"41f911a1da43d51265959cd2227a2e5cb806e2d9970a8ec3ed4084bddd7e8aa0","runner_image":"rolebench.local/omp-native.distributed-lease-deadlock-runner@sha256:7380f77d231a3bbf7853ffd769f3194d4f39f724fd195f356c344b5c0906fd63","runner_platform":{"architecture":"amd64","os":"linux","variant":null},"verifier_config_digest_sha256":"a37778cd7b1563d7b8bdd0194c6cb49ba919b296fc5597924e7420613e481aaa","verifier_image":"rolebench.local/omp-native.distributed-lease-deadlock-verifier@sha256:c34ece628889ffc955db8e031784fd4769293c8b623a4d3c7094e08cd571ad29","verifier_platform":{"architecture":"amd64","os":"linux","variant":null}}},"schema_version":"omp.task-qualification/v2","source_task":{"digest_sha256":"38c6892706eb5292b4215bbd8fa4db9df36f255d2355054d7ff072ba4345ce86","path":"contracts/tasks/omp-native.distributed-lease-deadlock/1.0.0/task.json"},"task_id":"omp-native.distributed-lease-deadlock","task_version":"1.0.0"}
