{"checks":{"baseline_fails":{"command_digest_sha256":"2075fe87d5aaa6c4961b5e318015e60358618967655421ad595de36891fc61cf","evidence":[{"digest_sha256":"5b7ae1fa07282dec8f32050bf9b8c38ee6b0bc174a393d3b9ee2fb4ceb0cb8d1","path":"contracts/tasks/omp-native.code-review-defect-recall/1.0.0/evidence/baseline-1.json"},{"digest_sha256":"24984bda8afde5f39c1e9ae1465484313af15034fd964cf4672f0c7d1967f914","path":"contracts/tasks/omp-native.code-review-defect-recall/1.0.0/evidence/baseline-2.json"}],"result":"pass"},"determinism":"pass","discrimination":"calibration-required","infrastructure_classification":"pass","license":"pass","observation_authority":"pass","privacy":"pass","reference_passes":{"command_digest_sha256":"25bacc592606ca77cadf83aa9bdc23bca982f3eb1db47be5203b403b1b397271","evidence":[{"digest_sha256":"46ffc8d67c17787c24088934ba9d1c19b8237dcb11bf428915db01e61deeb323","path":"contracts/tasks/omp-native.code-review-defect-recall/1.0.0/evidence/reference-1.json"},{"digest_sha256":"f6cf6ff0492df2b1dfb7e6232f729da34c111734595c2f7d28b63b0bf663d98f","path":"contracts/tasks/omp-native.code-review-defect-recall/1.0.0/evidence/reference-2.json"}],"result":"pass"},"runner_isolation":"pass","tamper_resistance":{"command_digest_sha256":"17345a28347b70c864c759eaf8545f86f82c9a2db14f77954ab1922c10440e12","evidence":[{"digest_sha256":"87b54c7981069384a9f02ae11308dbffe6fa122f6591b26827bb42db64d3c0a9","path":"contracts/tasks/omp-native.code-review-defect-recall/1.0.0/evidence/tamper-1.json"},{"digest_sha256":"a7b71b868e53149b5905d75e3bbaadce5b6bc9f97d48ab40af6d0c5558d4662d","path":"contracts/tasks/omp-native.code-review-defect-recall/1.0.0/evidence/tamper-2.json"}],"result":"pass"},"verifier_isolation":"pass"},"content_digest_sha256":"127823704ef4da3f235c549b5ab0d192f529f0e612bce41da05c3a981e31d092","decision":"calibration-required","evaluation_provenance":{"review_digest_sha256":"343d5ee8b44ed914d36c8056ea72f08434bd83668865d6b467d61f465fb7e46e","reviewer_id":"rolebench/reviewer/verifier-gate-v1","runner_config_digest_sha256":"e9310f353abad747edc18f47c5fe439e1d81f6b5293b0d6a69019d8f91b4a209","runner_image":"rolebench.local/code-review-defect-recall-runner@sha256:2a5ebb5b775449de98863f19d8fc6374ce2ac62a123c62b041923edcad101887","runner_platform":{"architecture":"amd64","os":"linux","variant":null},"verifier_config_digest_sha256":"dbb98a0982184880a45b52f74e19e8fd3cfe3434bb0fca940e10e3ccdd0f2ba5","verifier_image":"rolebench.local/code-review-defect-recall-verifier@sha256:a3f504bea4d8cdf772f0962857cc2c69646214d116e95b581d1d8588d1656299","verifier_platform":{"architecture":"amd64","os":"linux","variant":null}},"observed_mapping":{"agent_config_digest_sha256":"fc08d1746546fc525415212c9d40a38c2f970afb22c3fa369743ab3960220154","public_tree_digest_sha256":"9444593766a7f04dcc1253a1eca0c0b47801f08dcb8442ad53f08bc00e51b33b","runner_config_digest_sha256":"e9310f353abad747edc18f47c5fe439e1d81f6b5293b0d6a69019d8f91b4a209","task_digest_sha256":"8dbfe4775f42636e2168d065d64ad77a6929b2049aad3a765e5fbe564c96c8d5","verifier_config_digest_sha256":"dbb98a0982184880a45b52f74e19e8fd3cfe3434bb0fca940e10e3ccdd0f2ba5","verifier_private_tree_digest_sha256":"d814c4a2799b28d92a79bb9d566163ee0d38ee299a3e5c59637217219aab2d1b"},"reviews":{"license":{"decision":"approved","evidence_digest_sha256":"29b700c8bd9a5fbe5ebd163b7e4c06c60e236ac6e09690f0f8d22c257d330073","evidence_path":"contracts/tasks/omp-native.code-review-defect-recall/1.0.0/reviews/license.json","expression":"MIT","redistribution":"permitted","reviewed_at":"2026-08-16T14:00:00Z","reviewer":"rolebench/reviewer/license-gate-v1"},"privacy":{"decision":"approved","evidence_digest_sha256":"1b73addb5bea071f886cb0862aa43dbb3212df3e224db64b515aa4bd3705054a","evidence_path":"contracts/tasks/omp-native.code-review-defect-recall/1.0.0/reviews/privacy.json","reviewed_at":"2026-08-16T14:00:00Z","reviewer":"rolebench/reviewer/privacy-gate-v1"},"split":{"assignment_method":"author-assigned","confidentiality":"public","decision":"approved","evidence_digest_sha256":"83e2a9875cb33d2c9da8eba58764151e548a67c14ffca978a5e0692190b01014","evidence_path":"contracts/tasks/omp-native.code-review-defect-recall/1.0.0/reviews/split.json","family_id":"omp-native.code-review-defect-recall","partition":"anchor","reviewed_at":"2026-08-16T14:00:00Z","reviewer":"rolebench/reviewer/role-fit-gate-v1"},"verifier":{"decision":"approved","evidence_digest_sha256":"343d5ee8b44ed914d36c8056ea72f08434bd83668865d6b467d61f465fb7e46e","evidence_path":"contracts/tasks/omp-native.code-review-defect-recall/1.0.0/reviews/verifier.json","private_tree_digest_sha256":"d814c4a2799b28d92a79bb9d566163ee0d38ee299a3e5c59637217219aab2d1b","reviewed_at":"2026-08-16T14:15:00Z","reviewer":"rolebench/reviewer/verifier-gate-v1","runner_config_digest_sha256":"e9310f353abad747edc18f47c5fe439e1d81f6b5293b0d6a69019d8f91b4a209","runner_image":"rolebench.local/code-review-defect-recall-runner@sha256:2a5ebb5b775449de98863f19d8fc6374ce2ac62a123c62b041923edcad101887","runner_platform":{"architecture":"amd64","os":"linux","variant":null},"verifier_config_digest_sha256":"dbb98a0982184880a45b52f74e19e8fd3cfe3434bb0fca940e10e3ccdd0f2ba5","verifier_image":"rolebench.local/code-review-defect-recall-verifier@sha256:a3f504bea4d8cdf772f0962857cc2c69646214d116e95b581d1d8588d1656299","verifier_platform":{"architecture":"amd64","os":"linux","variant":null}}},"schema_version":"omp.task-qualification/v2","source_task":{"digest_sha256":"87b0073cf11ca33cfa7101e520e4e1a961c6572efc121877a155ce5563429a3e","path":"contracts/tasks/omp-native.code-review-defect-recall/1.0.0/task.json"},"task_id":"omp-native.code-review-defect-recall","task_version":"1.0.0"}
