{"checks":{"baseline_fails":{"command_digest_sha256":"be4ab0995c9015dad5858c470f384e08d834d9dc8c9e9ab18d9485cf2f020302","evidence":[{"digest_sha256":"e31f5a3c0bc6ef00ab649ff30f43c608f057e08c88f768babd29822981ce720d","path":"contracts/tasks/terminal-bench.custom-memory-heap-crash/2.1-r6/evidence/baseline-1.json"},{"digest_sha256":"4351f7fed1b9a864a59d9749ec65b10afb3fad58fc31c4ee321b7364e595e5c5","path":"contracts/tasks/terminal-bench.custom-memory-heap-crash/2.1-r6/evidence/baseline-2.json"}],"result":"pass"},"determinism":"pass","discrimination":"calibration-required","infrastructure_classification":"pass","license":"pass","observation_authority":"pass","privacy":"pass","reference_passes":{"command_digest_sha256":"a62647e1c40718e8a06150c02bf53b87f4987ed3e860b5dd36aa27ebe06d94da","evidence":[{"digest_sha256":"24292a8ed1555fd6fa229a154f09fdd39e1e703f57aedd3f39d26f4f7e145e80","path":"contracts/tasks/terminal-bench.custom-memory-heap-crash/2.1-r6/evidence/reference-1.json"},{"digest_sha256":"db8e567d8b4383cac191f01fca656415895d915fd45097bb2f8e23477bf9be68","path":"contracts/tasks/terminal-bench.custom-memory-heap-crash/2.1-r6/evidence/reference-2.json"}],"result":"pass"},"runner_isolation":"pass","tamper_resistance":{"command_digest_sha256":"c9d2278150bfe22e2130f33e45f329004a20eefeb2e6f30a95e6f8f7621e52d1","evidence":[{"digest_sha256":"7b7cde97f7095894c11b21b326374208017e2a7e6115461f1500545ddd093767","path":"contracts/tasks/terminal-bench.custom-memory-heap-crash/2.1-r6/evidence/tamper-1.json"},{"digest_sha256":"8081efcbdaab7d92189a9f6080c4ef5f3d1003c3df5c3771b30117d87141887e","path":"contracts/tasks/terminal-bench.custom-memory-heap-crash/2.1-r6/evidence/tamper-2.json"}],"result":"pass"},"verifier_isolation":"pass"},"content_digest_sha256":"f6ad3649a6b4526af3dc9712560f224d13d6cf00a0130b359517f53d0f664f4a","decision":"calibration-required","evaluation_provenance":{"review_digest_sha256":"43cfd93b49870b2e9fdba661cadaab3142770edcd01b5f127823b72254afafe5","reviewer_id":"rolebench/reviewer/verifier-gate-v1","runner_config_digest_sha256":"13439514727d03e928094ef64b78703e1164eec7e007f9cdf97c7937a3b9bd68","runner_image":"rolebench.local/custom-memory-slow-runner@sha256:2ede9191e373a179079060d19101007a3b6266b98d23aae52053537d4ade0416","runner_platform":{"architecture":"amd64","os":"linux","variant":null},"verifier_config_digest_sha256":"edb45479a03bb0d709fdaf739ae2553a639b89a8a088afaed2f69afe3da26dff","verifier_image":"rolebench.local/custom-memory-verifier@sha256:f1729fb0edbfa40c7ab0a7bf46f1ccefd70f86720378d6f353ff1f3881d8cbf5","verifier_platform":{"architecture":"amd64","os":"linux","variant":null}},"observed_mapping":{"agent_config_digest_sha256":"314913d6648b40691dd52bbf1dc6264005aabded8ec2ed5bccbf1ee41c38f3d2","public_tree_digest_sha256":"e1829c0a1c99b3c20e4713054966cf99d974b2baae05930801219590a32afaa3","runner_config_digest_sha256":"13439514727d03e928094ef64b78703e1164eec7e007f9cdf97c7937a3b9bd68","task_digest_sha256":"da3d55c55e776ed511c7d9b3d1471502e33ec64a6c887a272e2c2f04e99d5301","verifier_config_digest_sha256":"edb45479a03bb0d709fdaf739ae2553a639b89a8a088afaed2f69afe3da26dff","verifier_private_tree_digest_sha256":"2dc97c80f8146e42f09b61c593cfadf35a99b8593bffcf38e28956444d74ec21"},"reviews":{"license":{"decision":"approved","evidence_digest_sha256":"fbd99838f3eff603de204400ff7920974d51953cca1eb0a71bc71cfb591f5a14","evidence_path":"contracts/tasks/terminal-bench.custom-memory-heap-crash/2.1-r6/reviews/license.json","expression":"Apache-2.0 AND MIT","redistribution":"permitted","reviewed_at":"2026-08-15T10:39:25Z","reviewer":"rolebench/reviewer/license-gate-v1"},"privacy":{"decision":"approved","evidence_digest_sha256":"2dc1b6ece248d4ff4bc91fa57547c62a42ed646884febaad766c5ac6c024eca7","evidence_path":"contracts/tasks/terminal-bench.custom-memory-heap-crash/2.1-r6/reviews/privacy.json","reviewed_at":"2026-08-15T10:39:25Z","reviewer":"rolebench/reviewer/privacy-gate-v1"},"split":{"assignment_method":"author-assigned","confidentiality":"public","decision":"approved","evidence_digest_sha256":"312a77bd82294544141976a34a1c7d3f90692aa9e246b9fc3f80ecca240eed78","evidence_path":"contracts/tasks/terminal-bench.custom-memory-heap-crash/2.1-r6/reviews/split.json","family_id":"terminal-bench.custom-memory-heap-crash","partition":"anchor","reviewed_at":"2026-08-15T10:39:25Z","reviewer":"rolebench/reviewer/role-fit-gate-v1"},"verifier":{"decision":"approved","evidence_digest_sha256":"43cfd93b49870b2e9fdba661cadaab3142770edcd01b5f127823b72254afafe5","evidence_path":"contracts/tasks/terminal-bench.custom-memory-heap-crash/2.1-r6/reviews/verifier.json","private_tree_digest_sha256":"2dc97c80f8146e42f09b61c593cfadf35a99b8593bffcf38e28956444d74ec21","reviewed_at":"2026-08-15T15:20:00Z","reviewer":"rolebench/reviewer/verifier-gate-v1","runner_config_digest_sha256":"13439514727d03e928094ef64b78703e1164eec7e007f9cdf97c7937a3b9bd68","runner_image":"rolebench.local/custom-memory-slow-runner@sha256:2ede9191e373a179079060d19101007a3b6266b98d23aae52053537d4ade0416","runner_platform":{"architecture":"amd64","os":"linux","variant":null},"verifier_config_digest_sha256":"edb45479a03bb0d709fdaf739ae2553a639b89a8a088afaed2f69afe3da26dff","verifier_image":"rolebench.local/custom-memory-verifier@sha256:f1729fb0edbfa40c7ab0a7bf46f1ccefd70f86720378d6f353ff1f3881d8cbf5","verifier_platform":{"architecture":"amd64","os":"linux","variant":null}}},"schema_version":"omp.task-qualification/v2","source_task":{"digest_sha256":"f3d475465963e0cac9a91ad5f2a2112eb96e2b4609d0d5e256483d85968a338b","path":"contracts/tasks/terminal-bench.custom-memory-heap-crash/2.1-r6/task.json"},"task_id":"terminal-bench.custom-memory-heap-crash","task_version":"2.1-r6"}
