{"checks":{"baseline_fails":{"command_digest_sha256":"3512e1311cfc0405a20decf51346fb3e7dd76eb883c2c2ed930f3f1896629653","evidence":[{"digest_sha256":"acb9042328f5de2519343165fa2afd716f31c2d73b89a59f8718248c80737100","path":"contracts/tasks/terminal-bench.multi-source-data-merger/2.1-r6/evidence/baseline-1.json"},{"digest_sha256":"6cd8084747196e2e9797efe60e28e07ac5856f1fc521f4394b9a4e5893d10dec","path":"contracts/tasks/terminal-bench.multi-source-data-merger/2.1-r6/evidence/baseline-2.json"}],"result":"pass"},"determinism":"pass","discrimination":"calibration-required","infrastructure_classification":"pass","license":"pass","observation_authority":"pass","privacy":"pass","reference_passes":{"command_digest_sha256":"bf445ac4b73272405a9e909bddd28e379e58c0f1e56f80478e77e01671bfc337","evidence":[{"digest_sha256":"e9bc774014cee3fd9f9385347b68504026467f0a7faa4e940b2de08c68236741","path":"contracts/tasks/terminal-bench.multi-source-data-merger/2.1-r6/evidence/reference-1.json"},{"digest_sha256":"cfec1354c6a085da9981dff7c2a46433f8c285793d3fa75f4253a347a8f90099","path":"contracts/tasks/terminal-bench.multi-source-data-merger/2.1-r6/evidence/reference-2.json"}],"result":"pass"},"runner_isolation":"pass","tamper_resistance":{"command_digest_sha256":"d228fd8a7249f38a410b138b6dabf72593ced5b74976175fe53cd29e9d7e12c9","evidence":[{"digest_sha256":"15d8719f4cecff1a7fedd855f712972bd8625f068211772e08b76d668f479f1a","path":"contracts/tasks/terminal-bench.multi-source-data-merger/2.1-r6/evidence/tamper-1.json"},{"digest_sha256":"17a5ac58f45b76e043aa5540f07289b53466eee1e436cdc80a467b7b26f4b9fa","path":"contracts/tasks/terminal-bench.multi-source-data-merger/2.1-r6/evidence/tamper-2.json"}],"result":"pass"},"verifier_isolation":"pass"},"content_digest_sha256":"e22e6fb60b0148e975888c99367fb0a48965a1c8846df2878ce290b91ec71b49","decision":"calibration-required","evaluation_provenance":{"review_digest_sha256":"10c28a9f9260c13d78eee175a72c519810cc0a9ba9d733ffa5de91042a69588d","reviewer_id":"rolebench/reviewer/verifier-gate-v1","runner_config_digest_sha256":"7bb6484a751fdf0cbe92dc00e3f52ed66580ec97e5e3337a54504f29b4e00f1d","runner_image":"rolebench.local/merger-default-runner@sha256:37eeaf92cf1cc8476d7fde4e7b349fa7dfa5211d632111598bc5936e774c4a2c","runner_platform":{"architecture":"amd64","os":"linux","variant":null},"verifier_config_digest_sha256":"b345901f7d397fc04c77cda185912b1ed1764553cf1b36cce24c068fc098effa","verifier_image":"rolebench.local/merger-default-verifier@sha256:9669177927788ace5665ed87b49253f5a8aa2fa00f2f96a1caf78d6d08e3e73d","verifier_platform":{"architecture":"amd64","os":"linux","variant":null}},"observed_mapping":{"agent_config_digest_sha256":"0e9d8c794b8ca1dd9c9da7cd91bda1700a5d15eee0adccb67c5864384dacea9a","public_tree_digest_sha256":"b92d6f0ba64e00ff02edc03bf62155c5eb21bec6446d130493ba13ff40363bf8","runner_config_digest_sha256":"7bb6484a751fdf0cbe92dc00e3f52ed66580ec97e5e3337a54504f29b4e00f1d","task_digest_sha256":"06808ed0a428925e4af169c521721f71f8e30616cdcf4858fafc47762cdf9079","verifier_config_digest_sha256":"b345901f7d397fc04c77cda185912b1ed1764553cf1b36cce24c068fc098effa","verifier_private_tree_digest_sha256":"edca1f40cd2322327f8aaa55ecd786bfcd32d1842fe1b7f56452fe293021b394"},"reviews":{"license":{"decision":"approved","evidence_digest_sha256":"34d231bb781f6234df3563fdd4614ca53d4ace4bace8afd12b6151a69aba45d4","evidence_path":"contracts/tasks/terminal-bench.multi-source-data-merger/2.1-r6/reviews/license.json","expression":"Apache-2.0 AND MIT","redistribution":"permitted","reviewed_at":"2026-08-14T17:36:49Z","reviewer":"rolebench/reviewer/license-gate-v1"},"privacy":{"decision":"approved","evidence_digest_sha256":"f319f8830d6b38781e17142ffab302236d37f6c2a4be71156327fdcf8e354775","evidence_path":"contracts/tasks/terminal-bench.multi-source-data-merger/2.1-r6/reviews/privacy.json","reviewed_at":"2026-08-14T17:36:49Z","reviewer":"rolebench/reviewer/privacy-gate-v1"},"split":{"assignment_method":"author-assigned","confidentiality":"public","decision":"approved","evidence_digest_sha256":"f5fc56bd20958875e8fed0a56b94239c0e5c8e54d47c3aa3f14c2c579a0a9f76","evidence_path":"contracts/tasks/terminal-bench.multi-source-data-merger/2.1-r6/reviews/split.json","family_id":"terminal-bench.multi-source-data-merger","partition":"anchor","reviewed_at":"2026-08-14T17:36:49Z","reviewer":"rolebench/reviewer/role-fit-gate-v1"},"verifier":{"decision":"approved","evidence_digest_sha256":"10c28a9f9260c13d78eee175a72c519810cc0a9ba9d733ffa5de91042a69588d","evidence_path":"contracts/tasks/terminal-bench.multi-source-data-merger/2.1-r6/reviews/verifier.json","private_tree_digest_sha256":"edca1f40cd2322327f8aaa55ecd786bfcd32d1842fe1b7f56452fe293021b394","reviewed_at":"2026-08-14T23:36:32Z","reviewer":"rolebench/reviewer/verifier-gate-v1","runner_config_digest_sha256":"7bb6484a751fdf0cbe92dc00e3f52ed66580ec97e5e3337a54504f29b4e00f1d","runner_image":"rolebench.local/merger-default-runner@sha256:37eeaf92cf1cc8476d7fde4e7b349fa7dfa5211d632111598bc5936e774c4a2c","runner_platform":{"architecture":"amd64","os":"linux","variant":null},"verifier_config_digest_sha256":"b345901f7d397fc04c77cda185912b1ed1764553cf1b36cce24c068fc098effa","verifier_image":"rolebench.local/merger-default-verifier@sha256:9669177927788ace5665ed87b49253f5a8aa2fa00f2f96a1caf78d6d08e3e73d","verifier_platform":{"architecture":"amd64","os":"linux","variant":null}}},"schema_version":"omp.task-qualification/v2","source_task":{"digest_sha256":"2bfba8678df6f1320c8d07d5fb904851193676e3a2c97391116de3b28734a5a5","path":"contracts/tasks/terminal-bench.multi-source-data-merger/2.1-r6/task.json"},"task_id":"terminal-bench.multi-source-data-merger","task_version":"2.1-r6"}
