{"checks":{"baseline_fails":{"command_digest_sha256":"4bd148d381ad62eedb2b86367c4187681d47a42ae2e3d5969c56ba2d2b59b0f4","evidence":[{"digest_sha256":"9968c0522175777e23fd1bf882ef406efc4a1a08f0997515ca417f024d3cae9b","path":"contracts/tasks/terminal-bench.db-wal-recovery/2.1-r6/evidence/baseline-1.json"},{"digest_sha256":"284bc4b5db47bd855e8f587336111523645ba4f3dc569779e98e74e9ed3d8942","path":"contracts/tasks/terminal-bench.db-wal-recovery/2.1-r6/evidence/baseline-2.json"}],"result":"pass"},"determinism":"pass","discrimination":"calibration-required","infrastructure_classification":"pass","license":"pass","observation_authority":"pass","privacy":"pass","reference_passes":{"command_digest_sha256":"fed515d5a238207e15c7ffdab08c9e15cbaa90b362d0af5a754008b3fa46c3d4","evidence":[{"digest_sha256":"26038402fc350a3f0f4346179cb186348a98678cd1eb5622a71611fd211527c1","path":"contracts/tasks/terminal-bench.db-wal-recovery/2.1-r6/evidence/reference-1.json"},{"digest_sha256":"91db3f44d7c70574411bfa3e799c9641a7a248852a278dd8457b75f85c4a530f","path":"contracts/tasks/terminal-bench.db-wal-recovery/2.1-r6/evidence/reference-2.json"}],"result":"pass"},"runner_isolation":"pass","tamper_resistance":{"command_digest_sha256":"f5cff3d8bb33710643b5fe1c7aaefb933b4b0dd69ff86c286517d7f03247854b","evidence":[{"digest_sha256":"2e7f45abc243e4aab4cf7c1c544072129507ba54307dc34727952e1e35e307ac","path":"contracts/tasks/terminal-bench.db-wal-recovery/2.1-r6/evidence/tamper-1.json"},{"digest_sha256":"75c2961d799f06a6dad424910b96c259e4164783412b5444d92cb6d0c3c963e5","path":"contracts/tasks/terminal-bench.db-wal-recovery/2.1-r6/evidence/tamper-2.json"}],"result":"pass"},"verifier_isolation":"pass"},"content_digest_sha256":"e1b7fdbb543a9897e8799c780f8a79853b294c0e11d1c9f31fa5ed36e5bbc5c7","decision":"calibration-required","evaluation_provenance":{"review_digest_sha256":"e8575c81dba0936261d300724faa1c19bc824b96546ffaeab72c93f4bc171625","reviewer_id":"rolebench/reviewer/verifier-gate-v1","runner_config_digest_sha256":"4c03ef6d6019139406c6a24c87f57e816c4722ecef08e42b7618dfe95d81d227","runner_image":"rolebench.local/wal-recovery-slow-runner@sha256:b774c909747482a880491d98f25cd264c095611f7e82bfa0e447ea72c0178a88","runner_platform":{"architecture":"amd64","os":"linux","variant":null},"verifier_config_digest_sha256":"54b0673ed14aa5815f0bd0dc5a9d363aa8e2f09fdceb40b51489d19bdc108ca8","verifier_image":"rolebench.local/wal-recovery-slow-verifier@sha256:0c45c50aebdb144207c3f4091975f4576789e5e4a89bd29bb605b06d1c92a5e1","verifier_platform":{"architecture":"amd64","os":"linux","variant":null}},"observed_mapping":{"agent_config_digest_sha256":"39aca14f886f63f7383316e8123239924011e246013d1f4ad3494cd04d60cea8","public_tree_digest_sha256":"3dd3312ba1e3b8e8b3fe2dc6368662e2c6fd5d920a569aaef99648feff960188","runner_config_digest_sha256":"4c03ef6d6019139406c6a24c87f57e816c4722ecef08e42b7618dfe95d81d227","task_digest_sha256":"fa722dbdeed96932b8fa0cf0cdd1b9d40e1187453a8861bc8799843f6b673918","verifier_config_digest_sha256":"54b0673ed14aa5815f0bd0dc5a9d363aa8e2f09fdceb40b51489d19bdc108ca8","verifier_private_tree_digest_sha256":"236958c34f96d8f10297cfaec57358a88fa232ceb25c6b9276ca90e92f6e632d"},"reviews":{"license":{"decision":"approved","evidence_digest_sha256":"10771561abc97a5c11a0fdb72e856a2923cc7ff86ebb4e9e860bedb7e11b139f","evidence_path":"contracts/tasks/terminal-bench.db-wal-recovery/2.1-r6/reviews/license.json","expression":"Apache-2.0 AND MIT","redistribution":"permitted","reviewed_at":"2026-08-15T07:35:52Z","reviewer":"rolebench/reviewer/license-gate-v1"},"privacy":{"decision":"approved","evidence_digest_sha256":"a51cad0caac2a154df7aa052dc612f9de90e410b3d3bad60472a30af3ccf69ca","evidence_path":"contracts/tasks/terminal-bench.db-wal-recovery/2.1-r6/reviews/privacy.json","reviewed_at":"2026-08-15T07:35:52Z","reviewer":"rolebench/reviewer/privacy-gate-v1"},"split":{"assignment_method":"author-assigned","confidentiality":"public","decision":"approved","evidence_digest_sha256":"6412a8dd28e57b606beffcb19929fb834c2dd75486c7acac895a2536c2e6bcf7","evidence_path":"contracts/tasks/terminal-bench.db-wal-recovery/2.1-r6/reviews/split.json","family_id":"terminal-bench.db-wal-recovery","partition":"anchor","reviewed_at":"2026-08-15T07:35:52Z","reviewer":"rolebench/reviewer/role-fit-gate-v1"},"verifier":{"decision":"approved","evidence_digest_sha256":"e8575c81dba0936261d300724faa1c19bc824b96546ffaeab72c93f4bc171625","evidence_path":"contracts/tasks/terminal-bench.db-wal-recovery/2.1-r6/reviews/verifier.json","private_tree_digest_sha256":"236958c34f96d8f10297cfaec57358a88fa232ceb25c6b9276ca90e92f6e632d","reviewed_at":"2026-08-15T08:57:46Z","reviewer":"rolebench/reviewer/verifier-gate-v1","runner_config_digest_sha256":"4c03ef6d6019139406c6a24c87f57e816c4722ecef08e42b7618dfe95d81d227","runner_image":"rolebench.local/wal-recovery-slow-runner@sha256:b774c909747482a880491d98f25cd264c095611f7e82bfa0e447ea72c0178a88","runner_platform":{"architecture":"amd64","os":"linux","variant":null},"verifier_config_digest_sha256":"54b0673ed14aa5815f0bd0dc5a9d363aa8e2f09fdceb40b51489d19bdc108ca8","verifier_image":"rolebench.local/wal-recovery-slow-verifier@sha256:0c45c50aebdb144207c3f4091975f4576789e5e4a89bd29bb605b06d1c92a5e1","verifier_platform":{"architecture":"amd64","os":"linux","variant":null}}},"schema_version":"omp.task-qualification/v2","source_task":{"digest_sha256":"1d5347c86390bf0d6d11ee3019955c9217cb5b070814e12cf88cceebc371d81e","path":"contracts/tasks/terminal-bench.db-wal-recovery/2.1-r6/task.json"},"task_id":"terminal-bench.db-wal-recovery","task_version":"2.1-r6"}
