{"checks":{"baseline_fails":{"command_digest_sha256":"974bc8fb0ad9cb3fd09b50359316c33a07350c5387da9e2f6e49dc259077f705","evidence":[{"digest_sha256":"88ec2f6c40467733202613084cbdc4c5ff8dde811a767922ea111c9d13e09497","path":"contracts/tasks/omp-native.code-review-precision-control/1.0.0/evidence/baseline-1.json"},{"digest_sha256":"5da1d74fa82af0a512acce5e5a51fdce7f9758bcc5b0310cb7c7bb49edc8fe64","path":"contracts/tasks/omp-native.code-review-precision-control/1.0.0/evidence/baseline-2.json"}],"result":"pass"},"determinism":"pass","discrimination":"calibration-required","infrastructure_classification":"pass","license":"pass","observation_authority":"pass","privacy":"pass","reference_passes":{"command_digest_sha256":"d897726be04785b7dcc3a52cffb4c2935d91f0e2a8393a5240789543f48e3d19","evidence":[{"digest_sha256":"76efd614da7b1e0ec4d7489da335946441e8e88aa5fa9d2ffdb1e50bd145d1a3","path":"contracts/tasks/omp-native.code-review-precision-control/1.0.0/evidence/reference-1.json"},{"digest_sha256":"b849866967d194a889a3bc19171d1797b3ee96cd524ea6d6cfade98599b0fad8","path":"contracts/tasks/omp-native.code-review-precision-control/1.0.0/evidence/reference-2.json"}],"result":"pass"},"runner_isolation":"pass","tamper_resistance":{"command_digest_sha256":"e2bc22cbf7ff30a4c5b7884e01c654eb697b53e2c456f7e0108d4c054175ddae","evidence":[{"digest_sha256":"7cd719c622245cc7687a533727ca37f5bf32e382520ce8703d272384dac12377","path":"contracts/tasks/omp-native.code-review-precision-control/1.0.0/evidence/tamper-1.json"},{"digest_sha256":"c98879066717e772226ef9dc0a622981f91a382a88db1df1b61dd231e1aea938","path":"contracts/tasks/omp-native.code-review-precision-control/1.0.0/evidence/tamper-2.json"}],"result":"pass"},"verifier_isolation":"pass"},"content_digest_sha256":"d2e0e55af7e61ee489cbe8685670d1558a3c625c65918098aabe6d65395347d2","decision":"calibration-required","evaluation_provenance":{"review_digest_sha256":"94fec9d7bf1e1d624f3518a2503c778ff72b9f118d470f05af306eaf0a60cbfb","reviewer_id":"rolebench/reviewer/verifier-gate-v1","runner_config_digest_sha256":"f13b70a87e2cf0061ae05188c2734d2821f35af092be14180edcb2edc689cdc6","runner_image":"rolebench.local/code-review-precision-runner@sha256:a5e1c35fd7cc9388704eead480464c9af0c51699e81bb047bc0af315adb467f5","runner_platform":{"architecture":"amd64","os":"linux","variant":null},"verifier_config_digest_sha256":"10dbd531317190808db5db4aebf9c6810841dfa1ccd4a6078f03df19d8a7b656","verifier_image":"rolebench.local/code-review-precision-verifier@sha256:204ece2ab143c639e0ce418de3d2ca34e65f1a802760627007f4f9cbc58c1950","verifier_platform":{"architecture":"amd64","os":"linux","variant":null}},"observed_mapping":{"agent_config_digest_sha256":"7b07a25094786c2c6cfced0cd732f53240d1b736a9fcbd4a387dd9ad37ea1d53","public_tree_digest_sha256":"f7b23e2d9bedcfe632764c0490a0ccf9c8193de93f8af82befef3975ad55bf73","runner_config_digest_sha256":"f13b70a87e2cf0061ae05188c2734d2821f35af092be14180edcb2edc689cdc6","task_digest_sha256":"9e39d026d20b3b7e6de97576ca7cff4b35574774db910c0ba2721a485e9b96f0","verifier_config_digest_sha256":"10dbd531317190808db5db4aebf9c6810841dfa1ccd4a6078f03df19d8a7b656","verifier_private_tree_digest_sha256":"3dcb9deba6b184c07eeae661591b413b444162a88eaa1c581cae50a3de73afbc"},"reviews":{"license":{"decision":"approved","evidence_digest_sha256":"a36b3dad5620ecb41e570bd3b18868b79c610548172968c0a34a8ead0c14cf9c","evidence_path":"contracts/tasks/omp-native.code-review-precision-control/1.0.0/reviews/license.json","expression":"MIT","redistribution":"permitted","reviewed_at":"2026-08-16T14:00:00Z","reviewer":"rolebench/reviewer/license-gate-v1"},"privacy":{"decision":"approved","evidence_digest_sha256":"0257ef3fdd55608c829e54f4aa284d9a74da49682f15d720d0262366fa4b67d0","evidence_path":"contracts/tasks/omp-native.code-review-precision-control/1.0.0/reviews/privacy.json","reviewed_at":"2026-08-16T14:00:00Z","reviewer":"rolebench/reviewer/privacy-gate-v1"},"split":{"assignment_method":"author-assigned","confidentiality":"public","decision":"approved","evidence_digest_sha256":"cf58b0a80091434528eced19e537398db0bd71a2d085b455be92ef2133177c47","evidence_path":"contracts/tasks/omp-native.code-review-precision-control/1.0.0/reviews/split.json","family_id":"omp-native.code-review-precision-control","partition":"anchor","reviewed_at":"2026-08-16T14:00:00Z","reviewer":"rolebench/reviewer/role-fit-gate-v1"},"verifier":{"decision":"approved","evidence_digest_sha256":"94fec9d7bf1e1d624f3518a2503c778ff72b9f118d470f05af306eaf0a60cbfb","evidence_path":"contracts/tasks/omp-native.code-review-precision-control/1.0.0/reviews/verifier.json","private_tree_digest_sha256":"3dcb9deba6b184c07eeae661591b413b444162a88eaa1c581cae50a3de73afbc","reviewed_at":"2026-08-16T14:15:00Z","reviewer":"rolebench/reviewer/verifier-gate-v1","runner_config_digest_sha256":"f13b70a87e2cf0061ae05188c2734d2821f35af092be14180edcb2edc689cdc6","runner_image":"rolebench.local/code-review-precision-runner@sha256:a5e1c35fd7cc9388704eead480464c9af0c51699e81bb047bc0af315adb467f5","runner_platform":{"architecture":"amd64","os":"linux","variant":null},"verifier_config_digest_sha256":"10dbd531317190808db5db4aebf9c6810841dfa1ccd4a6078f03df19d8a7b656","verifier_image":"rolebench.local/code-review-precision-verifier@sha256:204ece2ab143c639e0ce418de3d2ca34e65f1a802760627007f4f9cbc58c1950","verifier_platform":{"architecture":"amd64","os":"linux","variant":null}}},"schema_version":"omp.task-qualification/v2","source_task":{"digest_sha256":"d003240566d47c464c8c123088d2d746058e0182787d6918621f6bcded2dbbd6","path":"contracts/tasks/omp-native.code-review-precision-control/1.0.0/task.json"},"task_id":"omp-native.code-review-precision-control","task_version":"1.0.0"}
