{"checks":{"baseline_fails":{"command_digest_sha256":"ab6ac15ea9a8e16497257b07055879b5a8aeb4c23c2df34b698771d6032cd929","evidence":[{"digest_sha256":"1bf815be8d078c4a0d62fa7642237ec8938791f8bc9b7028f6678f4b3ebb4993","path":"contracts/tasks/omp-native.diff-commit-message/1.0.0/evidence/baseline-1.json"},{"digest_sha256":"7ca0ea5d1645d4a65fdee7652ad8ba9153a6a2e12e19e5c594744a90e084d3f3","path":"contracts/tasks/omp-native.diff-commit-message/1.0.0/evidence/baseline-2.json"}],"result":"pass"},"determinism":"pass","discrimination":"calibration-required","infrastructure_classification":"pass","license":"pass","observation_authority":"pass","privacy":"pass","reference_passes":{"command_digest_sha256":"b029330c8aad11e25a7f204017091b7561a62162841cbf92ba59a7149d6b4081","evidence":[{"digest_sha256":"5d5160dee8b212a7ae0e0461f8215f2c0f40d306f9d76d97fb5e3b8991d663f2","path":"contracts/tasks/omp-native.diff-commit-message/1.0.0/evidence/reference-1.json"},{"digest_sha256":"c827134a3614ba320cc4562ae5c8159312ec6a59688dcf53131e644c4a2649d5","path":"contracts/tasks/omp-native.diff-commit-message/1.0.0/evidence/reference-2.json"}],"result":"pass"},"runner_isolation":"pass","tamper_resistance":{"command_digest_sha256":"2a889a33424aaf340053bce4542bf7128bd5bf8f8c08599d109e829c19987261","evidence":[{"digest_sha256":"9b887dfbbe0ddb8e4f297cde34979ff897a02068c81e74459180a8d5f39c2288","path":"contracts/tasks/omp-native.diff-commit-message/1.0.0/evidence/tamper-1.json"},{"digest_sha256":"51e8f88ed32abed9376c73549894741d2c6c33e007c40d7d7686198861883c5d","path":"contracts/tasks/omp-native.diff-commit-message/1.0.0/evidence/tamper-2.json"}],"result":"pass"},"verifier_isolation":"pass"},"content_digest_sha256":"957be17e1589d08fe3a71794d4375822b68ca7f6ebad679ce5b419682d2c6bbc","decision":"calibration-required","evaluation_provenance":{"review_digest_sha256":"3ee500c6380d84c5e0c658b0a55ae9da777a6a66365bfe8bd9db7ad7d188c5c8","reviewer_id":"rolebench/reviewer/verifier-gate-v1","runner_config_digest_sha256":"68fb537fdd3790f5789a1a09b031c48298d3d9ab54d3d0df0211ac4399143b41","runner_image":"rolebench.local/diff-commit-message-commit-runner@sha256:f8c6b9ec51c4f4fc3ea30223ed28451ca248ffbbda812bd32a2872728f225717","runner_platform":{"architecture":"amd64","os":"linux","variant":null},"verifier_config_digest_sha256":"68b52fea18831dc1e6126bc1de3e4d9e815f680a32d46e2a8f56a021a0bc1178","verifier_image":"rolebench.local/diff-commit-message-commit-verifier@sha256:3dd3d2460a9997770b9a3bc972ab70e6bceaf463a8b2b291e7a24da0c0666039","verifier_platform":{"architecture":"amd64","os":"linux","variant":null}},"observed_mapping":{"agent_config_digest_sha256":"8d57d34f34093b5e76e9e05bbe6a5458e17a1d6b523c8b3f05ebf883fde7ddaa","public_tree_digest_sha256":"93cbacecbbd1cadac94576f710e7bd3d11a999d27b7a225c8e954c0802e3f8de","runner_config_digest_sha256":"68fb537fdd3790f5789a1a09b031c48298d3d9ab54d3d0df0211ac4399143b41","task_digest_sha256":"e6c5ce6adc19a809aaac5f0ebca4f5c863173c38b0073c68236343e6b469e4b9","verifier_config_digest_sha256":"68b52fea18831dc1e6126bc1de3e4d9e815f680a32d46e2a8f56a021a0bc1178","verifier_private_tree_digest_sha256":"09c37065867423f32caf4d5b7508ec2be47d867b6910aa0644e46479e37083c1"},"reviews":{"license":{"decision":"approved","evidence_digest_sha256":"182a0ed91c3ee45be59c6da6bc4e073393278a642724128f4ebe57c3de4e3149","evidence_path":"contracts/tasks/omp-native.diff-commit-message/1.0.0/reviews/license.json","expression":"MIT","redistribution":"permitted","reviewed_at":"2026-08-15T23:03:04Z","reviewer":"rolebench/reviewer/license-gate-v1"},"privacy":{"decision":"approved","evidence_digest_sha256":"95e494c6c87630125a7a9380f2d924795b6b267fd72312f0efb65137de090b12","evidence_path":"contracts/tasks/omp-native.diff-commit-message/1.0.0/reviews/privacy.json","reviewed_at":"2026-08-15T23:03:04Z","reviewer":"rolebench/reviewer/privacy-gate-v1"},"split":{"assignment_method":"author-assigned","confidentiality":"public","decision":"approved","evidence_digest_sha256":"75f9f928eeca9d05db1f363ef13777a2e44370c3dea31f6174cdd93d7002fed4","evidence_path":"contracts/tasks/omp-native.diff-commit-message/1.0.0/reviews/split.json","family_id":"omp-native.diff-commit-message","partition":"anchor","reviewed_at":"2026-08-15T23:03:04Z","reviewer":"rolebench/reviewer/role-fit-gate-v1"},"verifier":{"decision":"approved","evidence_digest_sha256":"3ee500c6380d84c5e0c658b0a55ae9da777a6a66365bfe8bd9db7ad7d188c5c8","evidence_path":"contracts/tasks/omp-native.diff-commit-message/1.0.0/reviews/verifier.json","private_tree_digest_sha256":"09c37065867423f32caf4d5b7508ec2be47d867b6910aa0644e46479e37083c1","reviewed_at":"2026-08-15T23:10:04Z","reviewer":"rolebench/reviewer/verifier-gate-v1","runner_config_digest_sha256":"68fb537fdd3790f5789a1a09b031c48298d3d9ab54d3d0df0211ac4399143b41","runner_image":"rolebench.local/diff-commit-message-commit-runner@sha256:f8c6b9ec51c4f4fc3ea30223ed28451ca248ffbbda812bd32a2872728f225717","runner_platform":{"architecture":"amd64","os":"linux","variant":null},"verifier_config_digest_sha256":"68b52fea18831dc1e6126bc1de3e4d9e815f680a32d46e2a8f56a021a0bc1178","verifier_image":"rolebench.local/diff-commit-message-commit-verifier@sha256:3dd3d2460a9997770b9a3bc972ab70e6bceaf463a8b2b291e7a24da0c0666039","verifier_platform":{"architecture":"amd64","os":"linux","variant":null}}},"schema_version":"omp.task-qualification/v2","source_task":{"digest_sha256":"c27b0d853ff96f227a20aee12a917ebbf6b8768f575ecc9350ed415c77944aad","path":"contracts/tasks/omp-native.diff-commit-message/1.0.0/task.json"},"task_id":"omp-native.diff-commit-message","task_version":"1.0.0"}
