{"checks":{"baseline_fails":{"command_digest_sha256":"8b4827eb884e4cdc574ce789c1b9b2a49a0348fa867a628017114ec28da1096e","evidence":[{"digest_sha256":"aa2375ce6b3b03608811c04136f557469af7c90dc6ff4ea90596ec0b7d229b6d","path":"contracts/tasks/terminal-bench.cancel-async-tasks/2.1-r6/evidence/baseline-1.json"},{"digest_sha256":"5da20630cb14e7af26384d79cc272af011f360ef117eb1629f0de31b38615203","path":"contracts/tasks/terminal-bench.cancel-async-tasks/2.1-r6/evidence/baseline-2.json"}],"result":"pass"},"determinism":"pass","discrimination":"calibration-required","infrastructure_classification":"pass","license":"pass","observation_authority":"pass","privacy":"pass","reference_passes":{"command_digest_sha256":"923e40166b1f723e78c7fa09d4ac92e94b6c9841c0c919859241bf5d4a33ca87","evidence":[{"digest_sha256":"4e0765e11f7ce5ac84159c43fffa08e806898b0dc0d37aabec147505bf13d126","path":"contracts/tasks/terminal-bench.cancel-async-tasks/2.1-r6/evidence/reference-1.json"},{"digest_sha256":"a95244e38bc380b80dd8948e448aa5139fa3cab62becb521fdab9f71071614ee","path":"contracts/tasks/terminal-bench.cancel-async-tasks/2.1-r6/evidence/reference-2.json"}],"result":"pass"},"runner_isolation":"pass","tamper_resistance":{"command_digest_sha256":"986c52ee39abe2cfb575a12c56d9eccfc19275fa8323b99f88e436e0b4db1342","evidence":[{"digest_sha256":"9ddbf33cb0d1d47e4fa33832bfbae456b0965f12d22b64aaf7b5c56f47e9ef75","path":"contracts/tasks/terminal-bench.cancel-async-tasks/2.1-r6/evidence/tamper-1.json"},{"digest_sha256":"be12ea9802687e8b8289f3c77f308f4a8464645dbfa3d6e541612656305791b3","path":"contracts/tasks/terminal-bench.cancel-async-tasks/2.1-r6/evidence/tamper-2.json"}],"result":"pass"},"verifier_isolation":"pass"},"content_digest_sha256":"95c60885c435fec4bc84ed6e6b2ef1672f3e894d59e8c96731fcd59275bf4039","decision":"calibration-required","evaluation_provenance":{"review_digest_sha256":"4d4ec066e9e6bee2eec4953bcd13d25c17f45fe895f943f9f6d855a41796b4c5","reviewer_id":"rolebench/reviewer/verifier-gate-v1","runner_config_digest_sha256":"c76084bf2e16baaf8fca581519b4411220e8e234b5a81e2a0d57da9f0e6655e8","runner_image":"rolebench.local/cancel-async-tasks-runner@sha256:a3ccf45c751c53543052d8de0d17f083d53ae1c9d41600f80dc2f21759f804b4","runner_platform":{"architecture":"amd64","os":"linux","variant":null},"verifier_config_digest_sha256":"5585f16719675a73a0592830db3dd2734d92e1632e8a0dab317317eebdc1b7b5","verifier_image":"rolebench.local/cancel-async-tasks-verifier@sha256:c5740ee5f71abd4c097c12ea7e7a9ec00b8f2e45dbfc3b42071ca9df3f0eddb7","verifier_platform":{"architecture":"amd64","os":"linux","variant":null}},"observed_mapping":{"agent_config_digest_sha256":"5061dc5f5a645558e6d89a126e4cb5d21d321226016c9601c4b02805745a96c8","public_tree_digest_sha256":"b34e50ce1f976a9adf9b419693794278937915ce2be9f13bf3d0b179c68541b4","runner_config_digest_sha256":"c76084bf2e16baaf8fca581519b4411220e8e234b5a81e2a0d57da9f0e6655e8","task_digest_sha256":"4804671d1f8a5db28fbc09beb41a9eaadb4376ecd80754dd3b2d1d3b4858811b","verifier_config_digest_sha256":"5585f16719675a73a0592830db3dd2734d92e1632e8a0dab317317eebdc1b7b5","verifier_private_tree_digest_sha256":"a36d27ac82469e8b97e9fbb5db1ea7101a809452e1d603e7e19656acf7b7cd5a"},"reviews":{"license":{"decision":"approved","evidence_digest_sha256":"b2707e5607c16f5b2c5314b8daec72eb51459b77586cdb00bb03e24fa7f69d1e","evidence_path":"contracts/tasks/terminal-bench.cancel-async-tasks/2.1-r6/reviews/license.json","expression":"Apache-2.0 AND MIT","redistribution":"permitted","reviewed_at":"2026-08-15T10:39:25Z","reviewer":"rolebench/reviewer/license-gate-v1"},"privacy":{"decision":"approved","evidence_digest_sha256":"d6b3e16fc5529f109cd0b7816800f1ac0053fbd24a9796e0a1885cb56a602e96","evidence_path":"contracts/tasks/terminal-bench.cancel-async-tasks/2.1-r6/reviews/privacy.json","reviewed_at":"2026-08-15T10:39:25Z","reviewer":"rolebench/reviewer/privacy-gate-v1"},"split":{"assignment_method":"author-assigned","confidentiality":"public","decision":"approved","evidence_digest_sha256":"39ac9dc52cc96bf9c3b475cb8fbf3fa0e63183476ca7bab779e8a96f51fadc9b","evidence_path":"contracts/tasks/terminal-bench.cancel-async-tasks/2.1-r6/reviews/split.json","family_id":"terminal-bench.cancel-async-tasks","partition":"anchor","reviewed_at":"2026-08-15T10:39:25Z","reviewer":"rolebench/reviewer/role-fit-gate-v1"},"verifier":{"decision":"approved","evidence_digest_sha256":"4d4ec066e9e6bee2eec4953bcd13d25c17f45fe895f943f9f6d855a41796b4c5","evidence_path":"contracts/tasks/terminal-bench.cancel-async-tasks/2.1-r6/reviews/verifier.json","private_tree_digest_sha256":"a36d27ac82469e8b97e9fbb5db1ea7101a809452e1d603e7e19656acf7b7cd5a","reviewed_at":"2026-08-15T13:50:00Z","reviewer":"rolebench/reviewer/verifier-gate-v1","runner_config_digest_sha256":"c76084bf2e16baaf8fca581519b4411220e8e234b5a81e2a0d57da9f0e6655e8","runner_image":"rolebench.local/cancel-async-tasks-runner@sha256:a3ccf45c751c53543052d8de0d17f083d53ae1c9d41600f80dc2f21759f804b4","runner_platform":{"architecture":"amd64","os":"linux","variant":null},"verifier_config_digest_sha256":"5585f16719675a73a0592830db3dd2734d92e1632e8a0dab317317eebdc1b7b5","verifier_image":"rolebench.local/cancel-async-tasks-verifier@sha256:c5740ee5f71abd4c097c12ea7e7a9ec00b8f2e45dbfc3b42071ca9df3f0eddb7","verifier_platform":{"architecture":"amd64","os":"linux","variant":null}}},"schema_version":"omp.task-qualification/v2","source_task":{"digest_sha256":"83e3c08482f08e4a0639ce8179c14c67735cae99dc77a1e78ef9a9790b6d3d1b","path":"contracts/tasks/terminal-bench.cancel-async-tasks/2.1-r6/task.json"},"task_id":"terminal-bench.cancel-async-tasks","task_version":"2.1-r6"}
