{"checks":{"baseline_fails":{"command_digest_sha256":"ef170bb39692e21aec299f4bf07a31543b46fa0f7c4ff452b531c899dc4f8293","evidence":[{"digest_sha256":"d68145fb93991a764391bec4ad19b990ad52bf49fbdb365f650e0bf5345af589","path":"contracts/tasks/omp-native.deprecation-annotation-pass/1.0.0/evidence/baseline-1.json"},{"digest_sha256":"8a990b19b7a7676f88a2a14224f546675f6389ab209284c4bcf948ddd954defd","path":"contracts/tasks/omp-native.deprecation-annotation-pass/1.0.0/evidence/baseline-2.json"}],"result":"pass"},"determinism":"pass","discrimination":"calibration-required","infrastructure_classification":"pass","license":"pass","observation_authority":"pass","privacy":"pass","reference_passes":{"command_digest_sha256":"44828747f70d53f811c061b1f592b4479d5eaecf2fd2a613e557ed948a8dc7b2","evidence":[{"digest_sha256":"eb65ff264b56c97c2e94cec5608fc140c5fe67cf68202609275b90b608d2565c","path":"contracts/tasks/omp-native.deprecation-annotation-pass/1.0.0/evidence/reference-1.json"},{"digest_sha256":"b049fbb7c9e583c479964183a07dea355601d3e50be244bdd8e0b64c903f98e5","path":"contracts/tasks/omp-native.deprecation-annotation-pass/1.0.0/evidence/reference-2.json"}],"result":"pass"},"runner_isolation":"pass","tamper_resistance":{"command_digest_sha256":"8d6a242c8e5aca86a3d8b3f7ec28727e140d54e41676d164a0ef4fddc06a7fa3","evidence":[{"digest_sha256":"9445a517742093727ba7bab40ab2b03ce04bb0987b7b6738d8abb0677a03ea14","path":"contracts/tasks/omp-native.deprecation-annotation-pass/1.0.0/evidence/tamper-1.json"},{"digest_sha256":"b744088d5856797a75e9488f0eb7274d55eed313d247fbbe29b8d7330984fba6","path":"contracts/tasks/omp-native.deprecation-annotation-pass/1.0.0/evidence/tamper-2.json"}],"result":"pass"},"verifier_isolation":"pass"},"content_digest_sha256":"2a2b4ab950828de35d099525fdd90d4dee4bc6856e09bf13d05aac6a801a4288","decision":"calibration-required","evaluation_provenance":{"review_digest_sha256":"2f7122739d1a76cdaeb039f61c69901e341afb877a36660d6fbb83d02e2a842e","reviewer_id":"rolebench/reviewer/verifier-gate-v1","runner_config_digest_sha256":"91944202183e751fc557734a88aeacb1b34dfe10ad163c14391b5f60cc9a0122","runner_image":"rolebench.local/omp-native.deprecation-annotation-pass-runner@sha256:f729ba137e65834aa7928a2caaf1e9a117d88b0ee44ccf5c4ff4bf5abf14205f","runner_platform":{"architecture":"amd64","os":"linux","variant":null},"verifier_config_digest_sha256":"97319c6be3c8b5038dda01cfe428c2972b46089b5492a6bba53a66188f5205b2","verifier_image":"rolebench.local/omp-native.deprecation-annotation-pass-verifier@sha256:f42b9758a641397eb0ef302f01fe745c926242b4867949e50cff7b471de29939","verifier_platform":{"architecture":"amd64","os":"linux","variant":null}},"observed_mapping":{"agent_config_digest_sha256":"4fcf8e74c7a9b0ee0754737c56ec2665a14c0544acf76d0720fbdeb61f89bc2a","public_tree_digest_sha256":"322b37a52268c891c1a6d759b18655e674644240a5f6fdcacbbd8fee77746a94","runner_config_digest_sha256":"91944202183e751fc557734a88aeacb1b34dfe10ad163c14391b5f60cc9a0122","task_digest_sha256":"a4a49de81b3bb4ae6c9adb9fd529a2d6a6de16cb2fca67ed6c7191e930fcd324","verifier_config_digest_sha256":"97319c6be3c8b5038dda01cfe428c2972b46089b5492a6bba53a66188f5205b2","verifier_private_tree_digest_sha256":"795c8bb9a218eb0009d6824e4aa89245bedbc2f6a9bdedc01054b415f8fcbea1"},"reviews":{"license":{"decision":"approved","evidence_digest_sha256":"818ea64ead3c2986aaf4eade3766f5bfd3fe492efc862742c20cde134de13146","evidence_path":"contracts/tasks/omp-native.deprecation-annotation-pass/1.0.0/reviews/license.json","expression":"MIT","redistribution":"permitted","reviewed_at":"2026-08-16T15:00:00Z","reviewer":"rolebench/reviewer/license-gate-v1"},"privacy":{"decision":"approved","evidence_digest_sha256":"6af34196cdaf987831c8383ecc5356e174b52459fdeeb4c764922bf7adf21dbf","evidence_path":"contracts/tasks/omp-native.deprecation-annotation-pass/1.0.0/reviews/privacy.json","reviewed_at":"2026-08-16T15:00:00Z","reviewer":"rolebench/reviewer/privacy-gate-v1"},"split":{"assignment_method":"author-assigned","confidentiality":"public","decision":"approved","evidence_digest_sha256":"158ab8236ac0dce44aa65c6db9c54b1dbac9d06b9deedc22031e8ea6efbcbc60","evidence_path":"contracts/tasks/omp-native.deprecation-annotation-pass/1.0.0/reviews/split.json","family_id":"omp-native.deprecation-annotation-pass","partition":"anchor","reviewed_at":"2026-08-16T15:00:00Z","reviewer":"rolebench/reviewer/role-fit-gate-v1"},"verifier":{"decision":"approved","evidence_digest_sha256":"2f7122739d1a76cdaeb039f61c69901e341afb877a36660d6fbb83d02e2a842e","evidence_path":"contracts/tasks/omp-native.deprecation-annotation-pass/1.0.0/reviews/verifier.json","private_tree_digest_sha256":"795c8bb9a218eb0009d6824e4aa89245bedbc2f6a9bdedc01054b415f8fcbea1","reviewed_at":"2026-08-16T15:15:00Z","reviewer":"rolebench/reviewer/verifier-gate-v1","runner_config_digest_sha256":"91944202183e751fc557734a88aeacb1b34dfe10ad163c14391b5f60cc9a0122","runner_image":"rolebench.local/omp-native.deprecation-annotation-pass-runner@sha256:f729ba137e65834aa7928a2caaf1e9a117d88b0ee44ccf5c4ff4bf5abf14205f","runner_platform":{"architecture":"amd64","os":"linux","variant":null},"verifier_config_digest_sha256":"97319c6be3c8b5038dda01cfe428c2972b46089b5492a6bba53a66188f5205b2","verifier_image":"rolebench.local/omp-native.deprecation-annotation-pass-verifier@sha256:f42b9758a641397eb0ef302f01fe745c926242b4867949e50cff7b471de29939","verifier_platform":{"architecture":"amd64","os":"linux","variant":null}}},"schema_version":"omp.task-qualification/v2","source_task":{"digest_sha256":"d81144c2ca03e2f3cc2365cf44afc986600f71c5bde20a43e649bcb5ae75a56a","path":"contracts/tasks/omp-native.deprecation-annotation-pass/1.0.0/task.json"},"task_id":"omp-native.deprecation-annotation-pass","task_version":"1.0.0"}
