{"checks":{"baseline_fails":{"command_digest_sha256":"082877d32381230a56a77aef0c79baa4d20a2d8e8072ad33bad5ac546f5ab037","evidence":[{"digest_sha256":"fcdbe1a24eb0b8045a4db79c6baf4852bae8f41b65de03a188c0c4d334906f72","path":"contracts/tasks/terminal-bench.sanitize-git-repo/2.1-r6/evidence/baseline-1.json"},{"digest_sha256":"d271e44f115ee2926621b1f3ee578a22922667b448c7b5b480763a59858160d0","path":"contracts/tasks/terminal-bench.sanitize-git-repo/2.1-r6/evidence/baseline-2.json"}],"result":"pass"},"determinism":"pass","discrimination":"calibration-required","infrastructure_classification":"pass","license":"pass","observation_authority":"pass","privacy":"pass","reference_passes":{"command_digest_sha256":"ffb1f0cceee316098173031ff4ce6564a64daff4e98ae43bae264db89bd66db7","evidence":[{"digest_sha256":"3202cc390d23754d7c132bcb3eff7dfeb5049648c8c1726fed84956cedaa5876","path":"contracts/tasks/terminal-bench.sanitize-git-repo/2.1-r6/evidence/reference-1.json"},{"digest_sha256":"1b8c13803258ec56e9b066d1e7adf67806c64ed112ab55de4868744de89b30da","path":"contracts/tasks/terminal-bench.sanitize-git-repo/2.1-r6/evidence/reference-2.json"}],"result":"pass"},"runner_isolation":"pass","tamper_resistance":{"command_digest_sha256":"0c15631b3226e9e5e6a36a6feec9a1dd3e6b14e31945b04a573f249b497922ba","evidence":[{"digest_sha256":"236ee4a0d4dfb71056f6e4dc79214d2096f31cba4fef4ebdc7846d5f8d7e29da","path":"contracts/tasks/terminal-bench.sanitize-git-repo/2.1-r6/evidence/tamper-1.json"},{"digest_sha256":"345dd3758b3b40af7539a6c514c2d779c3bf64efae7ee2315fed15b65dc8b5e3","path":"contracts/tasks/terminal-bench.sanitize-git-repo/2.1-r6/evidence/tamper-2.json"}],"result":"pass"},"verifier_isolation":"pass"},"content_digest_sha256":"dc2bfdf57dec3ddff909b0188cf593baedd422db8b53653dfcd8f67048300087","decision":"calibration-required","evaluation_provenance":{"review_digest_sha256":"55eac09946498e1ca2f18dc6878128b384f7c708e94482c6a221971eed522ee5","reviewer_id":"rolebench/reviewer/verifier-gate-v1","runner_config_digest_sha256":"3915fb06fc64773e977b832b140849469b9866d0a8d3921cdb52bf8e1cca568b","runner_image":"rolebench.local/sanitize-default-runner@sha256:62ae62b971150832b5bd848318cddba2526a38400a6972116ba53006f5705c7e","runner_platform":{"architecture":"amd64","os":"linux","variant":null},"verifier_config_digest_sha256":"5348735f1423d7f48972a765d3d3c45b58a41f40fc59caba4c065f027568d289","verifier_image":"rolebench.local/sanitize-default-verifier@sha256:08f44e93798433f5eb0acf61c566c9af8c9806f7d73b3d6d150d2242b397fe00","verifier_platform":{"architecture":"amd64","os":"linux","variant":null}},"observed_mapping":{"agent_config_digest_sha256":"2dcafd1c34b4d1fcaa210e51bd172202ded2409fb3c17e63b9b7418dbc73a280","public_tree_digest_sha256":"8ec5ca848187328046ed9c0617092fdb3c6ece7c16cff88555d655487551f389","runner_config_digest_sha256":"3915fb06fc64773e977b832b140849469b9866d0a8d3921cdb52bf8e1cca568b","task_digest_sha256":"9602a1390c953a933e77aabe6a795baf7a396d0fb5ef359551ea20381fa97de9","verifier_config_digest_sha256":"5348735f1423d7f48972a765d3d3c45b58a41f40fc59caba4c065f027568d289","verifier_private_tree_digest_sha256":"bba4905d65622fbd093b035f1d171c113250f35a5bd8f646dcbb8e13a37cefa1"},"reviews":{"license":{"decision":"approved","evidence_digest_sha256":"9b67cc4ae7f236945e4e2a6ad5d6ab4d312c89e6b3316fbe84af00c192edd2ca","evidence_path":"contracts/tasks/terminal-bench.sanitize-git-repo/2.1-r6/reviews/license.json","expression":"Apache-2.0 AND MIT","redistribution":"permitted","reviewed_at":"2026-08-14T17:36:49Z","reviewer":"rolebench/reviewer/license-gate-v1"},"privacy":{"decision":"approved","evidence_digest_sha256":"9049f149a5d3bfd3fa789ed82476280f081650577ddefedfa80e2fbadcaf893f","evidence_path":"contracts/tasks/terminal-bench.sanitize-git-repo/2.1-r6/reviews/privacy.json","reviewed_at":"2026-08-14T17:36:49Z","reviewer":"rolebench/reviewer/privacy-gate-v1"},"split":{"assignment_method":"author-assigned","confidentiality":"public","decision":"approved","evidence_digest_sha256":"d6250f0c9d5567c8a8c82a433593c19deafed2848c2bb0ad1e3abca0d967f307","evidence_path":"contracts/tasks/terminal-bench.sanitize-git-repo/2.1-r6/reviews/split.json","family_id":"terminal-bench.sanitize-git-repo","partition":"anchor","reviewed_at":"2026-08-14T17:36:49Z","reviewer":"rolebench/reviewer/role-fit-gate-v1"},"verifier":{"decision":"approved","evidence_digest_sha256":"55eac09946498e1ca2f18dc6878128b384f7c708e94482c6a221971eed522ee5","evidence_path":"contracts/tasks/terminal-bench.sanitize-git-repo/2.1-r6/reviews/verifier.json","private_tree_digest_sha256":"bba4905d65622fbd093b035f1d171c113250f35a5bd8f646dcbb8e13a37cefa1","reviewed_at":"2026-08-15T00:45:58Z","reviewer":"rolebench/reviewer/verifier-gate-v1","runner_config_digest_sha256":"3915fb06fc64773e977b832b140849469b9866d0a8d3921cdb52bf8e1cca568b","runner_image":"rolebench.local/sanitize-default-runner@sha256:62ae62b971150832b5bd848318cddba2526a38400a6972116ba53006f5705c7e","runner_platform":{"architecture":"amd64","os":"linux","variant":null},"verifier_config_digest_sha256":"5348735f1423d7f48972a765d3d3c45b58a41f40fc59caba4c065f027568d289","verifier_image":"rolebench.local/sanitize-default-verifier@sha256:08f44e93798433f5eb0acf61c566c9af8c9806f7d73b3d6d150d2242b397fe00","verifier_platform":{"architecture":"amd64","os":"linux","variant":null}}},"schema_version":"omp.task-qualification/v2","source_task":{"digest_sha256":"cc63d075219bb6c39b70e8c7913ec0bab544247c640f62111c7af141ef76b0b7","path":"contracts/tasks/terminal-bench.sanitize-git-repo/2.1-r6/task.json"},"task_id":"terminal-bench.sanitize-git-repo","task_version":"2.1-r6"}
