{"checks":{"baseline_fails":{"command_digest_sha256":"3b4eda76d979b749d7f15bfa8b9a65a83f5979c70b7d38821751bba1769cf446","evidence":[{"digest_sha256":"d6f5a92117816ee0111ef06cb92d9e9c11f2697182a1b11eea2440e0de3fd9c0","path":"contracts/tasks/terminal-bench.memcached-backdoor/3.0-r1/evidence/baseline-1.json"},{"digest_sha256":"3d8245af680c732a08b6ae10ecb7de03a8fd8fbf3e5a2afaf8c786b28f057d5b","path":"contracts/tasks/terminal-bench.memcached-backdoor/3.0-r1/evidence/baseline-2.json"}],"result":"pass"},"determinism":"pass","discrimination":"calibration-required","infrastructure_classification":"pass","license":"pass","observation_authority":"pass","privacy":"pass","reference_passes":{"command_digest_sha256":"6b91ee5ac5bf31a28fde17059d65f0e13fcf04aeef1d51bbf795c21ecc3dee8a","evidence":[{"digest_sha256":"78f6a98ea4b540244a8c60be82035fd5af4db082440f619eb3e0403b3ee04eb8","path":"contracts/tasks/terminal-bench.memcached-backdoor/3.0-r1/evidence/reference-1.json"},{"digest_sha256":"e43afdbe10346cf169cc74ab8c926f86e730fd6a98f2662b80314649213446d1","path":"contracts/tasks/terminal-bench.memcached-backdoor/3.0-r1/evidence/reference-2.json"}],"result":"pass"},"runner_isolation":"pass","tamper_resistance":{"command_digest_sha256":"673c27b2ba2edc734a01bc228b4ce2428b3f216397d418529f9605267c455f7f","evidence":[{"digest_sha256":"8538db6aa9f57b646b0e2e64c6d6b1dbc0fcfebb7a624d892cf39d9d32533f0f","path":"contracts/tasks/terminal-bench.memcached-backdoor/3.0-r1/evidence/tamper-1.json"},{"digest_sha256":"bf19914521b46378b84a2516f0d5668c8f9258fb0d312ee48ce83375541ebd86","path":"contracts/tasks/terminal-bench.memcached-backdoor/3.0-r1/evidence/tamper-2.json"}],"result":"pass"},"verifier_isolation":"pass"},"content_digest_sha256":"2555abd5efa33f07cce7d863c27dcbc5061c9d1f321021bae6aa1b1bfc53a9ae","decision":"calibration-required","evaluation_provenance":{"review_digest_sha256":"d264266b65804c3fd1e3341e0658e04be68946171778a911173b3ec98e4f11a4","reviewer_id":"rolebench/reviewer/verifier-gate-v1","runner_config_digest_sha256":"7e9a3a2db91087636ec7b9a8a1773f5531a5303a1df078213708464bf84d2bd7","runner_image":"127.0.0.1:5000/rolebench/memcached-backdoor-advisor-runner@sha256:1667bcc4c9c6726c6c643490505e0ac55ede2c0e070c7d76f0375e5b1f369f3f","runner_platform":{"architecture":"amd64","os":"linux","variant":null},"verifier_config_digest_sha256":"ae5a2aa743071fc16b0f8326b731dfed6663e8fa2d95f45b81e7cefc6ac15bfb","verifier_image":"127.0.0.1:5000/rolebench/memcached-backdoor-advisor-verifier@sha256:816a13bdf4e6be2c2542de8e0b50b5e535873ee1122e222c5219a1161d11dd28","verifier_platform":{"architecture":"amd64","os":"linux","variant":null}},"observed_mapping":{"agent_config_digest_sha256":"aa7b1efe1f636633c77d6185cc9a47eb92387b5f16bedd1a4e3cfc1cb04b2a8b","public_tree_digest_sha256":"6c1ab6050dab918e1264883f63109f77af742401f6ed585075877bbf30f61ec9","runner_config_digest_sha256":"7e9a3a2db91087636ec7b9a8a1773f5531a5303a1df078213708464bf84d2bd7","task_digest_sha256":"45f11c247cd4f6619fd6bcefd54c6c26bd2db3b3d06528c26ac287a7e16b0be0","verifier_config_digest_sha256":"ae5a2aa743071fc16b0f8326b731dfed6663e8fa2d95f45b81e7cefc6ac15bfb","verifier_private_tree_digest_sha256":"0d5ae76c2cbb60ca004e2f9fd1a85412c52be5bc85e37a1c73cb5a847b5ab1ca"},"reviews":{"license":{"decision":"approved","evidence_digest_sha256":"73029da08cff118b0ae788f71bac39116c8cb62a0b42d36960af7b7b3b7899ff","evidence_path":"contracts/tasks/terminal-bench.memcached-backdoor/3.0-r1/reviews/license.json","expression":"Apache-2.0 AND MIT","redistribution":"permitted","reviewed_at":"2026-08-15T18:30:00Z","reviewer":"rolebench/reviewer/license-gate-v1"},"privacy":{"decision":"approved","evidence_digest_sha256":"b88cb03b488bafd8951ed558c29bb7334024834da0398952c81440de662c9e8f","evidence_path":"contracts/tasks/terminal-bench.memcached-backdoor/3.0-r1/reviews/privacy.json","reviewed_at":"2026-08-15T18:30:00Z","reviewer":"rolebench/reviewer/privacy-gate-v1"},"split":{"assignment_method":"author-assigned","confidentiality":"public","decision":"approved","evidence_digest_sha256":"fc08911cb0b4692157e5508222d82eb71bf11fb6ea4033932f60ff760125cfb6","evidence_path":"contracts/tasks/terminal-bench.memcached-backdoor/3.0-r1/reviews/split.json","family_id":"terminal-bench.memcached-backdoor","partition":"anchor","reviewed_at":"2026-08-15T18:30:00Z","reviewer":"rolebench/reviewer/role-fit-gate-v1"},"verifier":{"decision":"approved","evidence_digest_sha256":"d264266b65804c3fd1e3341e0658e04be68946171778a911173b3ec98e4f11a4","evidence_path":"contracts/tasks/terminal-bench.memcached-backdoor/3.0-r1/reviews/verifier.json","private_tree_digest_sha256":"0d5ae76c2cbb60ca004e2f9fd1a85412c52be5bc85e37a1c73cb5a847b5ab1ca","reviewed_at":"2026-08-15T18:30:00Z","reviewer":"rolebench/reviewer/verifier-gate-v1","runner_config_digest_sha256":"7e9a3a2db91087636ec7b9a8a1773f5531a5303a1df078213708464bf84d2bd7","runner_image":"127.0.0.1:5000/rolebench/memcached-backdoor-advisor-runner@sha256:1667bcc4c9c6726c6c643490505e0ac55ede2c0e070c7d76f0375e5b1f369f3f","runner_platform":{"architecture":"amd64","os":"linux","variant":null},"verifier_config_digest_sha256":"ae5a2aa743071fc16b0f8326b731dfed6663e8fa2d95f45b81e7cefc6ac15bfb","verifier_image":"127.0.0.1:5000/rolebench/memcached-backdoor-advisor-verifier@sha256:816a13bdf4e6be2c2542de8e0b50b5e535873ee1122e222c5219a1161d11dd28","verifier_platform":{"architecture":"amd64","os":"linux","variant":null}}},"schema_version":"omp.task-qualification/v2","source_task":{"digest_sha256":"f4be7e3cfd469422f501849f968f1799905f8eab183bd67aa1003a417c299994","path":"contracts/tasks/terminal-bench.memcached-backdoor/3.0-r1/task.json"},"task_id":"terminal-bench.memcached-backdoor","task_version":"3.0-r1"}
